{
  "title": "Karen in Naast with the view to Tournaig",
  "id": "karen-in-naast-withh-the-view-to-tournaig",
  "medium": "Acrylic on board",
  "Dimensions": {
    "width": 120,
    "height": 89
  },
  "year": "2025-03-03",
  "alt": "A naked woman lying in abstracted landscape with sea and mountains in the background",
  "image": "/src/images/DSC_0924(1).jpg",
  "active": true,
  "areaOfInterest": "bottom",
  "order": 19,
  "category": [
    "personal"
  ]
}