{
  "title": "Seonaid Nimmo ",
  "id": "seonaid-nimmo",
  "medium": "Acrylic on board",
  "Dimensions": {
    "width": 95,
    "height": 114
  },
  "year": "2018-05-15",
  "alt": "Woman in front of a colourful landscape of sea and mountains",
  "image": "/src/images/DSC_0390 - Copy.JPG",
  "active": true,
  "areaOfInterest": "centre",
  "order": 28,
  "category": [
    "personal"
  ]
}