{
    "title": "Stewart Macrae with MV Kindat",
    "id": "stewart-macrae-with-mv-kindat",
    "medium": "Acrylic on board",
    "Dimensions": {
      "width": 60,
      "height": 74
    },
    "year": "2019-06-19",
    "alt": "An older man pictured against a marine backdrop with a ship on the horizon ",
    "image": "/src/images/Stewart Macrae with MV Kindat - Acrylic on Board - 60cm x 74cm - 20219.jpg",
    "active": true,
    "areaOfInterest": "centre",
    "category": [
      "commissions"
    ],
    "order": 12
  }