{
  "title": "Campanula in Naast",
  "id": "campanula-in-naast",
  "medium": "Acrylic on board",
  "Dimensions": {
    "width": 23,
    "height": 30
  },
  "year": "2024-03-02",
  "alt": "A violet campanula flower",
  "image": "/src/images/campanula.jpg",
  "active": true,
  "areaOfInterest": "top",
  "order": 13,
  "category": [
    "flowers"
  ]
}