{
    "title": "Self Portrait at Firemore",
    "id": "self-portrait-at-firemore",
    "medium": "Acrylic on board",
    "Dimensions": {
      "width": 60,
      "height": 70
    },
    "year": "2023-10-10",
    "alt": "Head and shoulders of a man with his hair tied back. He does not have any clothes on. The background is a dark landscape.",
    "image": "/src/images/Self-Portrait at Firemore- Acrylic on Board - 60cm x 70cm - 2023.jpg",
    "active": true,
    "areaOfInterest": "centre",
    "category": [
      "personal"
    ],
    "order": 9
  }