{
    "title": "Mum in the Afternoon Light",
    "id": "mum-in-the-afternoon-light",
    "medium": "Acrylic on board",
    "Dimensions": {
      "width": 23,
      "height": 30
    },
    "year": "2025-03-07",
    "alt": "Close up of a woman's face. She is looking at something out of frame to the upper right.",
    "image": "/src/images/Mum in the afternoon light - Acrylic on Board -  23cm x 30cm - 2025.jpg",
    "active": true,
    "areaOfInterest": "centre",
    "category": [
      "personal"
    ],
    "order": 7
  }