{
    "title": "John and Lyndsay Todd",
    "id": "john-and-lyndsay-todd",
    "medium": "Acrylic on board",
    "Dimensions": {
      "width": 91,
      "height": 120
    },
    "year": "2021-06-09",
    "alt": "A man and a woman embracing. The man has a tattoo on his arm and the woman is heavily pregnant.",
    "image": "/src/images/John and Lyndsay Todd - Acrylic on Board - 91cm x  120cm - 2021.jpg",
    "active": true,
    "areaOfInterest": "centre",
    "category": [
      "personal"
    ],
    "order": 5
  }