{
  "title": "Isobel Armstrong in front of Ardmore",
  "id": "isobel-armstrong-in-front-of-ardmore",
  "medium": "Acrylic on board",
  "Dimensions": {
    "width": 60,
    "height": 74
  },
  "year": "2024-09-22",
  "alt": "Elderly woman smiling in front of her home",
  "image": "/src/images/Isobel Armstron.jpg",
  "active": true,
  "areaOfInterest": "centre",
  "order": 28,
  "category": [
    "commissions"
  ]
}