{
  "title": "Clem and Connie",
  "id": "clem-and-connie",
  "medium": "Acrylic on board",
  "Dimensions": {
    "width": 20,
    "height": 30
  },
  "year": "2023-08-22",
  "alt": "Two toddlers standing on the beach with their back to the viewer looking at the sea",
  "image": "/src/images/DSC_0550.JPG",
  "active": true,
  "areaOfInterest": "centre",
  "order": 27,
  "category": [
    "commissions"
  ]
}