{
  "title": "John Tiller with bottle of Barolo wine",
  "id": "john-tiller",
  "medium": "Acrylic on board",
  "Dimensions": {
    "width": 70,
    "height": 89
  },
  "year": "2019-07-03",
  "alt": "A man seated looking at the viewer holding a bottle of Barola wine with vineyards in the background",
  "image": "/src/images/DSC_1348 (2).JPG",
  "active": true,
  "areaOfInterest": "top",
  "order": 18,
  "category": [
    "commissions"
  ]
}